Category,Topic,Description,Do,Don't,Code Example Good,Code Example Bad,Severity,Keywords
"Spacing Systems","Consistent Spacing Scale","Use a consistent spacing scale (e.g., 4px, 8px, 12px, 16px, 24px, 32px, 48px, 64px). All spacing should come from this scale.","Use spacing scale tokens","Use arbitrary spacing values","padding: var(--spacing-md); /* 16px */","padding: 17px;",High,"spacing scale,spacing system,consistency"
"Spacing Systems","Visual Rhythm","Create visual rhythm through varied spacing—tight groupings, generous separations. Not the same padding everywhere.","Vary spacing for rhythm","Use identical spacing everywhere",".group { gap: var(--spacing-sm); } .section { margin-top: var(--spacing-xl); }",".group { padding: 16px; } .section { padding: 16px; }",Medium,"visual rhythm,spacing variation"
"Grid Systems","Grid Foundation","Use CSS Grid or Flexbox for layout. Grid provides structure and alignment.","Use CSS Grid for layout","Use floats or absolute positioning for layout","display: grid; grid-template-columns: repeat(12, 1fr);","float: left; position: absolute;",High,"CSS Grid,layout,grid system"
"Grid Systems","Break the Grid","Break the grid intentionally for emphasis. Not everything needs to align perfectly.","Break grid intentionally for emphasis","Force everything to align perfectly","grid-column: 1 / -1; /* full width for emphasis */","All items strictly aligned",Low,"grid,alignment,emphasis"
"Container Queries","Use Container Queries","Use container queries (@container) for component-level responsiveness instead of only viewport-based breakpoints.","Use container queries for components","Only use viewport breakpoints","@container (min-width: 400px) { ... }","@media (min-width: 768px) { ... }",Medium,"container queries,responsive design"
"Fluid Spacing","Fluid Spacing","Use clamp() for fluid spacing that breathes on larger screens.","Use clamp() for fluid spacing","Use fixed spacing","padding: clamp(1rem, 5vw, 3rem);","padding: 2rem;",Medium,"fluid spacing,clamp,responsive"
"Whitespace","Intentional Whitespace","Use whitespace intentionally, not just leftover. Whitespace creates breathing room and hierarchy.","Use whitespace intentionally","Fill every pixel",".section { margin-bottom: var(--spacing-2xl); }",".section { margin-bottom: 0; }",Medium,"whitespace,breathing room,hierarchy"
"Visual Hierarchy","Size Hierarchy","Use size to communicate importance. Larger elements draw attention first.","Use size for hierarchy","Make everything similar size","h1 { font-size: 2.5rem; } h2 { font-size: 1.5rem; }","h1 { font-size: 1.2rem; } h2 { font-size: 1.1rem; }",High,"visual hierarchy,size,importance"
"Visual Hierarchy","Spacing Hierarchy","Related items should be closer together (proximity principle). Unrelated items should have more space.","Group related items with spacing","Space everything equally",".related { gap: var(--spacing-sm); } .unrelated { margin-top: var(--spacing-xl); }","Everything: gap: 16px;",High,"proximity,grouping,spacing hierarchy"
